{
  "schema_version": "1.0.0",
  "design_id": "learnpilot-rag-hybrid-rerank-ablation-design-v1",
  "status": "COMPLETE",
  "ready_for_hybrid_rerank_implementation": true,
  "scope_declarations": {
    "design_only": true,
    "hybrid_implemented": false,
    "reranker_implemented": false,
    "experimental_llm_calls": 0,
    "embedding_executions": 0,
    "faiss_retrieval_executions": 0,
    "baseline_rerun": false,
    "production_rag_modified": false,
    "gold_modified": false,
    "corpus_modified": false,
    "parameter_tuning_performed": false
  },
  "frozen_inputs": {
    "manifest_schema": {
      "path": "evals/rag_real_world_corpus/v1/ablation_design_v1/ablation_design_manifest.schema.json",
      "sha256": "73c4dff4082d85f3aec383a59e4e18eaeff8eb65f467e8dcbd587085a054e626"
    },
    "gold": {
      "path": "evals/rag_real_world_corpus/v1/gold/v1/gold_cases.json",
      "sha256": "33a0b69901fa47e3fe45be0277228cd4a5519fe780fe5b9d2c52b1bfe614927a",
      "case_count": 72,
      "claim_count": 132
    },
    "freeze_manifest": {
      "path": "evals/rag_real_world_corpus/v1/gold/v1/gold_dataset_v1_freeze_manifest.json",
      "sha256": "d979079be4eb901a825ab29414dd7b5124d030182e09b55eea1e93749c12a5c2"
    },
    "corpus_manifest": {
      "path": "evals/rag_real_world_corpus/v1/corpus_manifest.json",
      "sha256": "6f67d510cd35197f107400d33033972c0c3c84478174e4991e491f6c8e4ab563",
      "document_count": 11,
      "runtime_chunk_count": 442
    },
    "chunk_inventory": {
      "path": "evals/rag_real_world_corpus/v1/results/ingestion_v1/20260813T131304Z-ac0a8cee/chunk_inventory.json",
      "sha256": "7eb626dfaa0706bfd7e5fad02af8b94a3925e37ce212c3218973e58cadf03616",
      "chunk_count": 442,
      "chunk_char_min": 63,
      "chunk_char_max": 850,
      "chunk_char_mean": 427.34
    },
    "dense_control": {
      "run_id": "20260814T052007Z-593cd2ac",
      "run_manifest_path": "evals/rag_real_world_corpus/v1/results/dense_only_baseline_v1/20260814T052007Z-593cd2ac/run_manifest.json",
      "run_manifest_sha256": "9b19c9c223d10d8bb7e81087adcf1a394874d8c7f89304cf0a847be8169c37b0",
      "raw_results_path": "evals/rag_real_world_corpus/v1/results/dense_only_baseline_v1/20260814T052007Z-593cd2ac/raw_results.json",
      "raw_results_sha256": "bf718aed08e226149c9310cbf20bf25c403708217e2908789120178ac5574e28",
      "reuse_without_rerun": true,
      "rerun_only_if_execution_is_proven_invalid": true
    },
    "failure_analysis": {
      "manifest_path": "evals/rag_real_world_corpus/v1/failure_analysis_v1/failure_analysis_manifest.json",
      "manifest_sha256": "e869fd73e2570413595c1af194b6ec6876e8b822fbd4eac279541a03cac27fb8",
      "ablation_hypotheses_path": "evals/rag_real_world_corpus/v1/failure_analysis_v1/ablation_hypotheses.json",
      "ablation_hypotheses_sha256": "27184ff8ddbf628f78767ede545e202ee66cb9ff17f56728961a8ce2d801f610",
      "addressability_matrix_path": "evals/rag_real_world_corpus/v1/failure_analysis_v1/optimization_addressability_matrix.json",
      "addressability_matrix_sha256": "877d2ba3948e5bdcf530307b4719cd46df74ae5c4680547fab7fa09374f31726",
      "case_analysis_path": "evals/rag_real_world_corpus/v1/failure_analysis_v1/case_failure_analysis.json",
      "case_analysis_sha256": "406527bcb6b7efeea885175bb9ea5f99af1b3bf91ccc0c79711d88854bc57b1e"
    },
    "production_code_binding": {
      "source_manifest_path": "evals/rag_real_world_corpus/v1/failure_analysis_v1/failure_analysis_manifest.json",
      "binding_field": "frozen_bindings.production_code.baseline_sha256",
      "file_count": 15,
      "all_files_match_on_design_freeze": true
    },
    "existing_dependency_contract": {
      "requirements_path": "backend/requirements.txt",
      "requirements_sha256": "e08fd5128623a834b74d12bf11471dd4af1f64bbcffbc58ed3b4d17ad1c8d26e",
      "rrf_implementation_present": false,
      "bm25_implementation_present": false,
      "sentence_transformers_version": "5.6.0"
    }
  },
  "current_pipeline_contract": {
    "contract_id": "CURRENT_PIPELINE_CONTRACT",
    "verified_against_real_production_implementation": true,
    "stage_order": [
      "original query",
      "optional production query rewrite",
      "BGE-M3 query embedding",
      "FAISS IndexFlatIP search",
      "material-scope filtering and dense Top 18 truncation",
      "deterministic dense sort",
      "dense score eligibility threshold 0.35",
      "same-material adjacent substantial-overlap deduplication",
      "document diversity first pass",
      "rank-ordered backfill",
      "final Top 6 selection",
      "per-chunk 2200-character cap and total 12000-character context budget",
      "DeepSeek structured grounded generation",
      "evidence-bound citation validation and persistence"
    ],
    "source_locations": [
      {
        "stage": "optional query rewrite",
        "path": "backend/app/services/rag/service.py",
        "lines": "164-191",
        "detail": "Production history is loaded, rewrite_query is called, and the resulting query is passed unchanged to retrieval."
      },
      {
        "stage": "rewrite guard",
        "path": "backend/app/services/rag/query_rewriter.py",
        "lines": "16-54",
        "detail": "Fresh conversations have no history and therefore return the original question without an LLM rewrite."
      },
      {
        "stage": "candidate budget",
        "path": "backend/app/services/rag/retrieval.py",
        "lines": "24-40",
        "detail": "candidate_limit=min(search_top_k_max, max(top_k*3, top_k)); frozen top_k=6 and search_top_k_max=20 produce 18."
      },
      {
        "stage": "dense embedding and search",
        "path": "backend/app/services/vector_store/service.py",
        "lines": "199-290",
        "detail": "The cleaned query is embedded, FAISS is searched, material scope is applied, dense hits are sorted, and the response is truncated to the requested candidate limit."
      },
      {
        "stage": "FAISS implementation",
        "path": "backend/app/services/vector_store/faiss_store.py",
        "lines": "123-125,166-195",
        "detail": "The index is IndexFlatIP and query search returns inner-product scores."
      },
      {
        "stage": "threshold",
        "path": "backend/app/services/rag/retrieval.py",
        "lines": "52-56",
        "detail": "Dense candidates are deterministically sorted and then filtered by rag_min_score=0.35."
      },
      {
        "stage": "overlap deduplication",
        "path": "backend/app/services/rag/retrieval.py",
        "lines": "10-21,57-66",
        "detail": "Adjacent chunks from the same material are rejected when substantial overlap is detected."
      },
      {
        "stage": "document diversity and backfill",
        "path": "backend/app/services/rag/retrieval.py",
        "lines": "67-83",
        "detail": "First pass caps each material at ceil(max_sources/2)=3; second pass backfills in rank order."
      },
      {
        "stage": "final selection and context budget",
        "path": "backend/app/services/rag/retrieval.py",
        "lines": "75-108",
        "detail": "Selection stops at Top 6, chunks are capped at 2200 characters, and total context is capped at 12000 characters."
      },
      {
        "stage": "generation and citation",
        "path": "backend/app/services/rag/service.py",
        "lines": "232-304",
        "detail": "The selected evidence enters grounded generation; answerability and evidence-bound citations are then persisted."
      }
    ],
    "effective_parameters": {
      "diagnostic_candidate_limit": 18,
      "production_final_top_k": 6,
      "minimum_dense_score": 0.35,
      "max_sources": 6,
      "per_material_first_pass_cap": 3,
      "max_chunk_chars": 2200,
      "context_budget_chars": 12000
    },
    "implementation_seam_assessment": {
      "current_state": "retrieve_sources currently combines candidate generation, thresholding, deduplication, diversity, and context budgeting in one function.",
      "required_seam": "Expose one ordered CandidatePool between retrieval/fusion/reranking and evidence governance.",
      "candidate_pool_interface": "build_candidate_pool(query, scope, arm_config) -> ordered candidates with identity and score provenance",
      "evidence_governance_interface": "govern_evidence(ordered_candidates, frozen_policy) -> final evidence plus rejection reasons",
      "implementation_guidance": "Extract the existing governance implementation once and call it for all four arms; do not copy it into arm-specific paths."
    }
  },
  "arms": {
    "dense_only": {
      "role": "Frozen control; reuse run 20260814T052007Z-593cd2ac without rerun.",
      "retrieval": "dense_bge_m3_faiss",
      "fusion": null,
      "reranker": null,
      "candidate_pool_limit": 18,
      "ordering_score": "dense_score",
      "eligibility_gate": "dense_score >= 0.35",
      "allowed_changes": [],
      "forbidden_changes": ["hybrid", "fusion", "reranker", "governance", "generation", "citation"],
      "shared_contract_ref": "#/shared"
    },
    "hybrid": {
      "role": "Measure lexical complement to dense candidate recall.",
      "retrieval": "dense_bge_m3_faiss_plus_bm25_okapi",
      "fusion": "rrf_k_60",
      "reranker": null,
      "candidate_pool_limit": 18,
      "ordering_score": "fusion_score",
      "eligibility_gate": "dense_score >= 0.35 OR bm25_rank IS NOT NULL",
      "allowed_changes": ["candidate retrieval", "fusion"],
      "forbidden_changes": ["reranker", "dedup", "diversity", "context budget", "generation", "prompt", "citation"],
      "shared_contract_ref": "#/shared"
    },
    "dense_rerank": {
      "role": "Measure independent query-chunk ordering on the unchanged dense candidate pool.",
      "retrieval": "dense_bge_m3_faiss",
      "fusion": null,
      "reranker": "preferred_frozen_reranker",
      "candidate_pool_limit": 18,
      "ordering_score": "reranker_score",